### ISSUE TITLE
Still image on Raspberry Pi

### ISSUE THREAD

**Issue by arkdchst** [brutella/hkcam#131]
When I run _hkcam_ on Raspberry Pi with USB camera attached to it, I can add camera to my Home app on iPhone, snapshots preview updates about every 10 seconds, but _live video_ framerate is near zero (image updates about every 30-60 seconds).

Then I attached this USB camera to my mac, and run hkcam on it. Always is working perfect with both iSight camera and USB camera. FPS from mac is about 3-5, and it's okay.

So I run hkcam:
`./build/hkcam --data_dir=cmd/hkcam/db --h264_encoder h264 --verbose`

I can't see any errors in output messages. So looks out the status line of ffmpeg
`frame=   83 fps=4.5 q=-1.0 Lsize=     455kB time=00:00:11.80 bitrate= 316.1kbits/s speed=0.633x`
Yes, fps is very low here, but it's positive. Near same values were on Mac.

I tried also run tcpdump, it shows hundreds of packets like this:
```
03:53:28.931848 IP elke.lan.60609 > 192.168.0.183.60404: UDP, length 1374
03:53:28.932282 IP elke.lan.60609 > 192.168.0.183.60404: UDP, length 1374
03:53:28.932715 IP elke.lan.60609 > 192.168.0.183.60404: UDP, length 1374
03:53:28.933142 IP elke.lan.60609 > 192.168.0.183.60404: UDP, length 1292
03:53:28.982983 IP elke.lan.60609 > 192.168.0.183.60404: UDP, length 682
```
Here 192.168.0.183 is iPhone.

These UDP packets running at high rate (it means ffmpeg is successfully sending frames?)

Raspberry Pi and Mac and iPhone are on same 5Ghz WiFi network.

I tested on hkcam versions: master, 0.2.0, v0.1.0, v0.0.9 (file hkcam-v0.0.9_linux_armhf.tar.gz).

OS version: Raspbian bullseye (with latest packages and kernel)
ffmpeg version: 4.3.4 (also tried 5.0.1)
